{
  "schema_version": "paper-to-skill-gate.v1",
  "generated_at": "2026-06-24T08:36:17Z",
  "paper": {
    "title": "P0 Pack: Leakage And Decontamination",
    "paper_type": "paper_pack",
    "year": 2025,
    "venue": "arXiv",
    "identity_confidence": "live_verified"
  },
  "sources": [
    {
      "label": "Rephrased Samples arXiv",
      "url": "https://arxiv.org/abs/2311.04850",
      "evidence_type": "paper",
      "notes": "Benchmark contamination via paraphrase/translation/rephrasing."
    },
    {
      "label": "llm-decontaminator local code",
      "url": "Tools/paper-to-skill-gate/paper-repos/llm-decontaminator",
      "evidence_type": "local_code",
      "notes": "Local HEAD 931834a."
    },
    {
      "label": "SemDeDup arXiv",
      "url": "https://arxiv.org/abs/2303.09540",
      "evidence_type": "paper",
      "notes": "Semantic duplicate removal."
    },
    {
      "label": "SemDeDup local code",
      "url": "Tools/paper-to-skill-gate/paper-repos/SemDeDup",
      "evidence_type": "local_code",
      "notes": "Local HEAD 6b41945."
    },
    {
      "label": "Leaner Training Lower Leakage arXiv",
      "url": "https://arxiv.org/abs/2506.20856",
      "evidence_type": "paper",
      "notes": "LoRA fine-tuning memorization comparison."
    },
    {
      "label": "LoRA-Leak arXiv",
      "url": "https://arxiv.org/abs/2507.18302",
      "evidence_type": "paper",
      "notes": "Membership inference attacks against LoRA fine-tuned models."
    }
  ],
  "official_repo": {
    "status": "not_applicable",
    "repo": "multi-paper-pack",
    "url": "",
    "stars": null,
    "pushed_at": null,
    "local_path": "",
    "local_head": null,
    "code_mapping_status": "UNSPECIFIED"
  },
  "reference_repo_influences": [
    "paper2code: split paper-only LoRA leakage claims from code-confirmed decontamination mechanics.",
    "DeepPaperNote: report keeps privacy risk and benchmark contamination risk distinct.",
    "MinerU-Document-Explorer: future batch explorer can index leakage/decontamination papers together.",
    "paper-qa: near-duplicate and leakage claims should be citation-grounded before becoming gate thresholds.",
    "MinerU: full PDF/OCR pass is needed for exact LoRA-Leak and Leaner Training tables.",
    "docling-mcp: conversion fallback supports source-bundle generation without training."
  ],
  "algorithm_traits": [
    "Rephrased-sample contamination detection",
    "Semantic duplicate pruning via embeddings and clustering",
    "LoRA memorization and MIA risk",
    "Family/template/semantic split pressure"
  ],
  "maformac_insertion_points": [
    {
      "path": "Core/Training/C5LoRATraining.swift",
      "lane": "retrain_c5",
      "recommendation": "Extend candidate data quality gate with semantic overlap and leakage receipts.",
      "proof_class": "local_static_teardown"
    },
    {
      "path": "Tools/C5TrainingCLI/c5_mlx_train_loop.py",
      "lane": "retrain_c5",
      "recommendation": "Training outputs must preserve source snapshot references; no hidden train/eval reuse.",
      "proof_class": "local_static_teardown"
    },
    {
      "path": "Core/Bench/C6VehicleToolBench.swift",
      "lane": "rebuild_c6",
      "recommendation": "Held-out cases need family/template/semantic protection before C6 is a final gate.",
      "proof_class": "local_static_teardown"
    },
    {
      "path": "contracts/c6-bench-cases.jsonl",
      "lane": "rebuild_c6",
      "recommendation": "Future C6 case metadata should include split family/template lineage.",
      "proof_class": "local_static_teardown"
    }
  ],
  "openspec_candidates": [
    "Future C5 requirement: exact ID split SHALL NOT be sufficient for train-ready status.",
    "Future C5/C6 design: semantic overlap scan SHALL be considered before adapter candidate signoff."
  ],
  "deliverables": [
    "Tools/paper-to-skill-gate/trial-runs/leakage-decontamination-pack-p0.md",
    "Tools/paper-to-skill-gate/trial-runs/leakage-decontamination-pack-p0.gate.json"
  ],
  "gate": {
    "status": "retrain_c5_input",
    "proof_class": ["web_verified", "local_static_teardown", "schema_validated", "not_executed"],
    "rationale": "Protects C5/C6 from exact-ID-only fake green and from overclaiming LoRA privacy safety.",
    "stop_conditions": [
      "No train-ready declaration from exact-ID split alone.",
      "No privacy-safe claim for LoRA.",
      "No API-based decontamination on private/raw data without explicit authorization.",
      "No raw customer/source material in repo."
    ]
  },
  "residual_risks": [
    "Pack-level official_repo is intentionally not_applicable: llm-decontaminator and SemDeDup local-code evidence applies only to their own claims, not to Leaner Training or LoRA-Leak.",
    "Leaner Training and LoRA-Leak are paper-only in this pass.",
    "Semantic decontamination thresholds are not selected for MAformac yet.",
    "OpenAI/API detector paths are unsuitable for private data without a separate redaction contract."
  ]
}
